Resultats/tableaux/Statistiques_series.csv

;non différencié;;;;;différencié;;;;
Séries;Moyenne;écart-type;kurtosis (aplatissement);skewness (asymétrie);;Moyenne;écart-type;kurtosis;asymétrie;
Malo;21.79;11.86;8.82;1.42;;0;5.76;77.1;0.22;en microgramme par metre cube de PM10
Alfred;27275,98;9059,1;2,15;0,7;;-1,62;187,43;17,3;-0,25;
Dylan;12.8983;7.4401;2.6818;0.1525;;0.0005;1.0145;3.9383;0.1359;
Tom;;;;;;;;;;
Bahr;41530,92;5812;1,9;-0,019;;-62;983;2,12;-0,1;MW
Tarik;;;;;;;;;;

Resultats/README.md

### Analyse des résultats

**Série de Malo :** 
Cette série porte sur la pollution de l'air, et présente une kurtosis élevée(8.82) qui augmente très fortement avec la différenciation (77.1).
Cela témoigne de valeurs très élevées fréquentes, expliquant ainsi l'écart type élevé de 11.86 pour une grandeur positive de moyenne 21.78.
Concernant les résultats de prédiction, on obtient globalement des prédictions peu performantes sûrement dues à la grande kurtosis de la 
série. Le modèle ELM est moins performant que la persistance sur toutes les métriques, malgré une normalisation des entrées et 
une absence de surapprentissage: la non linéarité de l'ELM ne semble pas ici être un avantage. D'ailleurs, 
on peut observer sur la validation que augmenter le nombre de neurones L diminuait la performance, un modèle plus simple semble meilleur.
C'est également le cas pour le modèle ARp qui se dégrade avec p qui augmente, les retards additionnels semblent pertuber la prédiction, mais cela est presque sûrement une erreur de code ça ce phénomène est observé même sur les données d'apprentissage. Enfin,
la différenciation augmente drastiquement l'efficacité pour l'ELM (11 points de nRMSE de mieux) mais diminue l'efficacité de l'ARp (0.6 points de nRMSE de moins). On peut 
imaginer que la série était sujette à de fortes tendances (hebdomadaires avec les trajets maison-travail ou surtout saisonnier avec les 
pics de pollution estivaux). C'est finalement le modèle AR non différencié qui est le plus performant sur toutes les métriques, avec 25.19% 
de nRMSE contre 25.99% pour la persistance, le gain de performance de prédiction n'est donc pas substantiel, mais il existe.

Une analyse physique et statistique préalable met en évidence la forte inertie thermique de la série brute, caractérisée par un écart-type de 7.44°C. Afin d'isoler la dynamique à court terme de la température, une différenciation temporelle a été appliquée. Cette opération mathématique rend le signal stationnaire : la moyenne s'effondre autour de 0°C et l'écart-type chute drastiquement à 1.01°C, prouvant que les variations thermiques d'une heure à l'autre sont minimes et structurellement plus stables pour un algorithme d'apprentissage.